<?xml version="1.0"?>
<Batch xmlns="http://creditinfo.com/schemas/Sample/Data" xmlns:xs="http://www.w3.org/2001/XMLSchema" xs:schemaLocation="https://creditinfocandidate2k.z16.web.core.windows.net/assets/Data.xsd">
	<Contract>
		<ContractCode>1</ContractCode>
		<ContractData>
			<PhaseOfContract>Open</PhaseOfContract>
			<OriginalAmount>
				<Value>2</Value>
				<Currency></Currency>
			</OriginalAmount>
			<InstallmentAmount>
				<Value>2</Value>
				<Currency></Currency>
			</InstallmentAmount>
			<CurrentBalance>
				<Value>3</Value>
				<Currency></Currency>
			</CurrentBalance>
			<OverdueBalance>
				<Value>4</Value>
				<Currency></Currency>
			</OverdueBalance>
			<DateOfLastPayment>2022-12-20Z</DateOfLastPayment>
			<NextPaymentDate>2022-12-20Z</NextPaymentDate>
			<DateAccountOpened>2022-12-20Z</DateAccountOpened>
			<RealEndDate>2022-12-20Z</RealEndDate>
		</ContractData>
		<Individual>
			<CustomerCode></CustomerCode>
			<FirstName></FirstName>
			<LastName></LastName>
			<Gender></Gender>
			<DateOfBirth>2022-12-20Z</DateOfBirth>
			<IdentificationNumbers></IdentificationNumbers>
		</Individual>
		<SubjectRole>
			<CustomerCode></CustomerCode>
			<RoleOfCustomer></RoleOfCustomer>
			<GuaranteeAmount>3</GuaranteeAmount>
		</SubjectRole>
	</Contract>
	<Contract>
		<ContractCode>1</ContractCode>
		<ContractData>
			<PhaseOfContract>Open</PhaseOfContract>
			<OriginalAmount>
				<Value>2p</Value>
				<Currency></Currency>
			</OriginalAmount>
			<InstallmentAmount>
				<Value>2</Value>
				<Currency></Currency>
			</InstallmentAmount>
			<CurrentBalance>
				<Value>3</Value>
				<Currency></Currency>
			</CurrentBalance>
			<OverdueBalance>
				<Value>4</Value>
				<Currency></Currency>
			</OverdueBalance>
			<DateOfLastPayment>2022-12-20Z</DateOfLastPayment>
			<NextPaymentDate>2022-12-20Z</NextPaymentDate>
			<DateAccountOpened>2022-12-20Z</DateAccountOpened>
			<RealEndDate>2022-12-20Z</RealEndDate>
		</ContractData>
		<Individual>
			<CustomerCode></CustomerCode>
			<FirstName></FirstName>
			<LastName></LastName>
			<Gender></Gender>
			<DateOfBirth>2022-12-20Z</DateOfBirth>
			<IdentificationNumbers></IdentificationNumbers>
		</Individual>
		<SubjectRole>
			<CustomerCode></CustomerCode>
			<RoleOfCustomer></RoleOfCustomer>
			<GuaranteeAmount>3</GuaranteeAmount>
		</SubjectRole>
	</Contract>
</Batch>