<?xml version="1.0" encoding="utf-8"?>
<Batch xmlns="http://creditinfo.com/schemas/Sample/Data" xmlns:xsi="http://www.w3.org/2001/XMLSchema-instance" xmlns:xsd="http://www.w3.org/2001/XMLSchema" xsi:schemaLocation="https://creditinfocandidate2k.z16.web.core.windows.net/assets/Data.xsd">
  <Contract>
    <ContractCode>1str1234</ContractCode>
    <ContractData>
      <PhaseOfContract>Open</PhaseOfContract>
      <OriginalAmount>
        <Value>123.45</Value>
        <Currency>AED</Currency>
      </OriginalAmount>
      <InstallmentAmount>
        <Value>123.45</Value>
        <Currency>AED</Currency>
      </InstallmentAmount>
      <CurrentBalance>
        <Value>123.45</Value>
        <Currency>AED</Currency>
      </CurrentBalance>
      <OverdueBalance>
        <Value>123.45</Value>
        <Currency>AED</Currency>
      </OverdueBalance>
      <DateOfLastPayment>2012-12-13</DateOfLastPayment>
      <NextPaymentDate>2012-12-13</NextPaymentDate>
      <DateAccountOpened>2012-12-13</DateAccountOpened>
      <RealEndDate>2012-12-13</RealEndDate>
    </ContractData>
    <Individual>
      <CustomerCode>str1234</CustomerCode>
      <FirstName>str1234</FirstName>
      <LastName>str1234</LastName>
      <Gender>Male</Gender>
      <DateOfBirth>2012-12-13</DateOfBirth>
      <IdentificationNumbers>
        <NationalID>ID1234567</NationalID>
      </IdentificationNumbers>
    </Individual>
    <SubjectRole>
      <CustomerCode>str1234</CustomerCode>
      <RoleOfCustomer>MainDebtor</RoleOfCustomer>
      <GuaranteeAmount>
        <Value>123.45</Value>
        <Currency>AED</Currency>
      </GuaranteeAmount>
    </SubjectRole>
    <SubjectRole>
      <CustomerCode>str1234</CustomerCode>
      <RoleOfCustomer>MainDebtor</RoleOfCustomer>
      <GuaranteeAmount>
        <Value>123.45</Value>
        <Currency>AED</Currency>
      </GuaranteeAmount>
    </SubjectRole>
  </Contract>
  <Contract>
    <ContractCode>ContractCode2</ContractCode>
    <ContractData>
      <PhaseOfContract>Closed</PhaseOfContract>
      <OriginalAmount>
        <Value>-79228162514264337593543950335</Value>
        <Currency>AFN</Currency>
      </OriginalAmount>
      <InstallmentAmount>
        <Value>-79228162514264337593543950335</Value>
        <Currency>AFN</Currency>
      </InstallmentAmount>
      <CurrentBalance>
        <Value>-79228162514264337593543950335</Value>
        <Currency>AFN</Currency>
      </CurrentBalance>
      <OverdueBalance>
        <Value>-79228162514264337593543950335</Value>
        <Currency>AFN</Currency>
      </OverdueBalance>
      <DateOfLastPayment>0001-01-01</DateOfLastPayment>
      <NextPaymentDate>0001-01-01</NextPaymentDate>
      <DateAccountOpened>0001-01-01</DateAccountOpened>
      <RealEndDate>0001-01-01</RealEndDate>
    </ContractData>
    <Individual>
      <CustomerCode>CustomerCode4</CustomerCode>
      <FirstName>FirstName4</FirstName>
      <LastName>LastName4</LastName>
      <Gender>Female</Gender>
      <DateOfBirth>1899-11-30</DateOfBirth>
      <IdentificationNumbers>
        <NationalID>NationalID4</NationalID>
      </IdentificationNumbers>
    </Individual>
    <Individual>
      <CustomerCode>CustomerCode5</CustomerCode>
      <FirstName>FirstName5</FirstName>
      <LastName>LastName5</LastName>
      <Gender></Gender>
      <DateOfBirth>1900-02-02</DateOfBirth>
      <IdentificationNumbers>
        <NationalID>NationalID5</NationalID>
      </IdentificationNumbers>
    </Individual>
    <Individual>
      <CustomerCode>CustomerCode6</CustomerCode>
      <FirstName>FirstName6</FirstName>
      <LastName>LastName6</LastName>
      <Gender>NotSpecified</Gender>
      <DateOfBirth>0001-02-02</DateOfBirth>
      <IdentificationNumbers>
        <NationalID>NationalID6</NationalID>
      </IdentificationNumbers>
    </Individual>
    <SubjectRole>
      <CustomerCode>CustomerCode4</CustomerCode>
      <RoleOfCustomer>MainDebtor</RoleOfCustomer>
      <GuaranteeAmount>
        <Value>0.9</Value>
        <Currency>AMD</Currency>
      </GuaranteeAmount>
    </SubjectRole>
    <SubjectRole>
      <CustomerCode>CustomerCode5</CustomerCode>
      <RoleOfCustomer>CoDebtor</RoleOfCustomer>
      <GuaranteeAmount>
        <Value>1.1</Value>
        <Currency>ANG</Currency>
      </GuaranteeAmount>
    </SubjectRole>
    <SubjectRole>
      <CustomerCode>CustomerCode6</CustomerCode>
      <RoleOfCustomer>Guarantor</RoleOfCustomer>
      <GuaranteeAmount>
        <Value>-79228162514264337593543950335</Value>
        <Currency>AOA</Currency>
      </GuaranteeAmount>
    </SubjectRole>
  </Contract>
  <Contract>
    <ContractCode>ase</ContractCode>
    <ContractData>
      <PhaseOfContract>Open</PhaseOfContract>
      <OriginalAmount>
        <Value>123.45</Value>
        <Currency>AED</Currency>
      </OriginalAmount>
      <InstallmentAmount>
        <Value>123.45</Value>
        <Currency>AED</Currency>
      </InstallmentAmount>
      <CurrentBalance>
        <Value>123.45</Value>
        <Currency>AED</Currency>
      </CurrentBalance>
      <OverdueBalance>
        <Value>123.45</Value>
        <Currency>AED</Currency>
      </OverdueBalance>
      <DateOfLastPayment>2012-12-13</DateOfLastPayment>
      <NextPaymentDate>2012-12-13</NextPaymentDate>
      <DateAccountOpened>2012-12-13</DateAccountOpened>
      <RealEndDate>2012-12-13</RealEndDate>
    </ContractData>
    <Individual>
      <CustomerCode>str1234</CustomerCode>
      <FirstName>str1234</FirstName>
      <LastName>str1234</LastName>
      <Gender>Male</Gender>
      <DateOfBirth>2012-12-13</DateOfBirth>
      <IdentificationNumbers>
        <NationalID>ID1234567</NationalID>
      </IdentificationNumbers>
    </Individual>
    <SubjectRole>
      <CustomerCode>str1234</CustomerCode>
      <RoleOfCustomer>MainDebtor</RoleOfCustomer>
      <GuaranteeAmount>
        <Value>123.45</Value>
        <Currency>AED</Currency>
      </GuaranteeAmount>
    </SubjectRole>
  </Contract>
  <Contract>
    <ContractCode>wew</ContractCode>
    <ContractData>
      <PhaseOfContract>Open</PhaseOfContract>
      <OriginalAmount>
        <Value>123.45</Value>
        <Currency>AED</Currency>
      </OriginalAmount>
      <InstallmentAmount>
        <Value>123.45</Value>
        <Currency>AED</Currency>
      </InstallmentAmount>
      <CurrentBalance>
        <Value>123.45</Value>
        <Currency>AED</Currency>
      </CurrentBalance>
      <OverdueBalance>
        <Value>123.45</Value>
        <Currency>AED</Currency>
      </OverdueBalance>
      <DateOfLastPayment>2012-12-13</DateOfLastPayment>
      <NextPaymentDate>2012-12-13</NextPaymentDate>
      <DateAccountOpened>2012-12-13</DateAccountOpened>
      <RealEndDate>2012-12-13</RealEndDate>
    </ContractData>
    <Individual>
      <CustomerCode>str1234</CustomerCode>
      <FirstName>str1234</FirstName>
      <LastName>str1234</LastName>
      <Gender>Male</Gender>
      <DateOfBirth>2012-12-13</DateOfBirth>
      <IdentificationNumbers>
        <NationalID>ID1234567</NationalID>
      </IdentificationNumbers>
    </Individual>
    <SubjectRole>
      <CustomerCode>str1234</CustomerCode>
      <RoleOfCustomer>MainDebtor</RoleOfCustomer>
      <GuaranteeAmount>
        <Value>123.45</Value>
        <Currency>AED</Currency>
      </GuaranteeAmount>
    </SubjectRole>
  </Contract>
  <Contract>
    <ContractCode>AQ</ContractCode>
    <ContractData>
      <PhaseOfContract>Open</PhaseOfContract>
      <OriginalAmount>
        <Value>123.45</Value>
        <Currency>AEDX</Currency>
      </OriginalAmount>
      <InstallmentAmount>
        <Value>123.45</Value>
        <Currency>AED</Currency>
      </InstallmentAmount>
      <CurrentBalance>
        <Value>123.45</Value>
        <Currency>AED</Currency>
      </CurrentBalance>
      <OverdueBalance>
        <Value>123.45</Value>
        <Currency>AED</Currency>
      </OverdueBalance>
      <DateOfLastPayment>2012-12-13</DateOfLastPayment>
      <NextPaymentDate>2012-12-13</NextPaymentDate>
      <DateAccountOpened>2012-12-13</DateAccountOpened>
      <RealEndDate>2012-12-13</RealEndDate>
    </ContractData>
    <Individual>
      <CustomerCode>str1234</CustomerCode>
      <FirstName>str1234</FirstName>
      <LastName>str1234</LastName>
      <Gender>Male</Gender>
      <DateOfBirth>2012-12-13</DateOfBirth>
      <IdentificationNumbers>
        <NationalID>ID1234567</NationalID>
      </IdentificationNumbers>
    </Individual>
    <SubjectRole>
      <CustomerCode>str1234</CustomerCode>
      <RoleOfCustomer>MainDebtor</RoleOfCustomer>
      <GuaranteeAmount>
        <Value>123.45</Value>
        <Currency>AED</Currency>
      </GuaranteeAmount>
    </SubjectRole>
  </Contract>
</Batch>